{
  "schema_version": "treecalc-workspace-v1",
  "workspace_id": "set-membership-active",
  "description": "Probe fixture for the active raw set-membership corpus. The runner blanks every non-target formula before each case, so each probe exercises its reference form in isolation while sharing one structural fixture.",
  "profile": "treecalc-v1",
  "nodes": [
    { "node_id": "Root", "formula": "" },

    { "node_id": "Root.ChildrenSugar", "formula": "" },
    { "node_id": "Root.ChildrenSugar.Accounts", "formula": "" },
    { "node_id": "Root.ChildrenSugar.Accounts.2005", "formula": "=SUM(Q1.*)" },
    { "node_id": "Root.ChildrenSugar.Accounts.2005.Q1", "formula": "" },
    { "node_id": "Root.ChildrenSugar.Accounts.2005.Q1.Income", "formula": "10" },
    { "node_id": "Root.ChildrenSugar.Accounts.2005.Q1.Margin", "formula": "20" },
    { "node_id": "Root.ChildrenSugar.Accounts.2005.Q1.Net", "formula": "30" },

    { "node_id": "Root.ChildrenAccessor", "formula": "" },
    { "node_id": "Root.ChildrenAccessor.Accounts", "formula": "" },
    { "node_id": "Root.ChildrenAccessor.Accounts.2005", "formula": "" },
    { "node_id": "Root.ChildrenAccessor.Accounts.2005.Q1", "formula": "=SUM(@CHILDREN)" },
    { "node_id": "Root.ChildrenAccessor.Accounts.2005.Q1.Income", "formula": "10" },
    { "node_id": "Root.ChildrenAccessor.Accounts.2005.Q1.Margin", "formula": "20" },
    { "node_id": "Root.ChildrenAccessor.Accounts.2005.Q1.Net", "formula": "30" },

    { "node_id": "Root.Ancestors", "formula": "" },
    { "node_id": "Root.Ancestors.Accounts", "formula": "" },
    { "node_id": "Root.Ancestors.Accounts.2005", "formula": "" },
    { "node_id": "Root.Ancestors.Accounts.2005.Q1", "formula": "" },
    { "node_id": "Root.Ancestors.Accounts.2005.Q1.Income", "formula": "" },
    { "node_id": "Root.Ancestors.Accounts.2005.Q1.Income.Sales", "formula": "=SUM(@ANCESTORS)" },

    { "node_id": "Root.Preceding", "formula": "" },
    { "node_id": "Root.Preceding.Accounts", "formula": "" },
    { "node_id": "Root.Preceding.Accounts.2005", "formula": "" },
    { "node_id": "Root.Preceding.Accounts.2005.Q1", "formula": "" },
    { "node_id": "Root.Preceding.Accounts.2005.Q1.Income", "formula": "10" },
    { "node_id": "Root.Preceding.Accounts.2005.Q1.Margin", "formula": "20" },
    { "node_id": "Root.Preceding.Accounts.2005.Q1.Net", "formula": "=SUM(@PRECEDING)" },

    { "node_id": "Root.PrecedingEmpty", "formula": "" },
    { "node_id": "Root.PrecedingEmpty.Accounts", "formula": "" },
    { "node_id": "Root.PrecedingEmpty.Accounts.2005", "formula": "" },
    { "node_id": "Root.PrecedingEmpty.Accounts.2005.Q1", "formula": "" },
    { "node_id": "Root.PrecedingEmpty.Accounts.2005.Q1.Income", "formula": "=SUM(@PRECEDING)" },
    { "node_id": "Root.PrecedingEmpty.Accounts.2005.Q1.Margin", "formula": "20" },
    { "node_id": "Root.PrecedingEmpty.Accounts.2005.Q1.Net", "formula": "30" },

    { "node_id": "Root.Following", "formula": "" },
    { "node_id": "Root.Following.Accounts", "formula": "" },
    { "node_id": "Root.Following.Accounts.2005", "formula": "" },
    { "node_id": "Root.Following.Accounts.2005.Q1", "formula": "" },
    { "node_id": "Root.Following.Accounts.2005.Q1.Income", "formula": "=SUM(@FOLLOWING)" },
    { "node_id": "Root.Following.Accounts.2005.Q1.Margin", "formula": "20" },
    { "node_id": "Root.Following.Accounts.2005.Q1.Net", "formula": "30" },

    { "node_id": "Root.RecursiveMatch", "formula": "" },
    { "node_id": "Root.RecursiveMatch.Accounts", "formula": "" },
    { "node_id": "Root.RecursiveMatch.Accounts.2005", "formula": "" },
    { "node_id": "Root.RecursiveMatch.Accounts.2005.Q1", "formula": "" },
    { "node_id": "Root.RecursiveMatch.Accounts.2005.Q1.Margin", "formula": "7" },
    { "node_id": "Root.RecursiveMatch.Accounts.2005.Q1.Net", "formula": "100" },
    { "node_id": "Root.RecursiveMatch.Accounts.2005.Q2", "formula": "" },
    { "node_id": "Root.RecursiveMatch.Accounts.2005.Q2.Margin", "formula": "11" },
    { "node_id": "Root.RecursiveMatch.Accounts.2005.Q2.Net", "formula": "200" },
    { "node_id": "Root.RecursiveMatch.Accounts.2005.Total", "formula": "=SUM(Accounts.2005.**.Margin)" },

    { "node_id": "Root.RecursiveAll", "formula": "" },
    { "node_id": "Root.RecursiveAll.Accounts", "formula": "" },
    { "node_id": "Root.RecursiveAll.Accounts.2005", "formula": "" },
    { "node_id": "Root.RecursiveAll.Accounts.2005.Q1", "formula": "" },
    { "node_id": "Root.RecursiveAll.Accounts.2005.Q1.Margin", "formula": "7" },
    { "node_id": "Root.RecursiveAll.Accounts.2005.Q1.Net", "formula": "100" },
    { "node_id": "Root.RecursiveAll.Accounts.2005.Q2", "formula": "" },
    { "node_id": "Root.RecursiveAll.Accounts.2005.Q2.Margin", "formula": "11" },
    { "node_id": "Root.RecursiveAll.Accounts.2005.Q2.Net", "formula": "100" },
    { "node_id": "Root.RecursiveAll.Accounts.2005.Total", "formula": "=SUM(Q2.**)" }
  ]
}
